{
  "$schema": "https://json-schema.org/draft-07/schema#",
  "$id": "https://github.com/open-agent-ai-security/praxen/blob/main/skills/behavior-verifier/findings.schema.json",
  "title": "Praxen canonical findings JSON — v3.0",
  "description": "Published contract for the Praxen canonical findings JSON (one object per analysis). Praxen's renderer ships with a hand-written runtime validator (`schema.py`) that enforces this shape *plus* cross-field invariants (counts match the arrays, anchors resolve, the six RAISE keys are present, weighted_overall = Σ(score × weight)). This file is the machine-readable contract for downstream tooling. Praxen 0.7.0+.",

  "type": "object",
  "additionalProperties": false,
  "required": [
    "schema_version", "praxen_version", "standards", "scan", "intro_band", "behavior_summary",
    "remit_coverage", "findings", "positives", "log_files", "raise_posture", "footer"
  ],
  "properties": {
    "schema_version": { "type": "string", "const": "3.1", "description": "Schema version. This published schema validates 3.1 documents exactly and is strict (additionalProperties is false; enums are closed). 3.1 adds the required `standards` block naming the OWASP editions the scan was scored against, and the optional scan.remit_version. 3.0 structured policy_rule_ids / policy_rule_text as parallel arrays (was scalar strings in 2.0). The forward-compatibility policy for future minors is in STABILITY.md." },
    "praxen_version": { "type": "string", "pattern": "^[0-9]+\\.[0-9]+\\.[0-9]+", "description": "Praxen version that produced this file (mirrors .claude-plugin/plugin.json)." },

    "standards": {
      "type": "object", "additionalProperties": false,
      "required": ["owasp_llm", "owasp_agentic", "owasp_mcp"],
      "description": "Which edition of each OWASP framework this scan was scored against. REQUIRED from schema 3.1: the taxonomy codes are not stable across editions (LLM03 is \"Supply Chain\" in 2025 and \"Excessive Agency\" in 2026; LLM04 and LLM10 also changed meaning), so a tag is ambiguous without the edition that defines it. Values are the edition actually used, not necessarily the newest the producing release knew about.",
      "properties": {
        "owasp_llm":     { "type": "string", "minLength": 1, "description": "Edition of the OWASP Top 10 for LLM Applications that LLM01-LLM10 tags refer to, e.g. \"2026\"." },
        "owasp_agentic": { "type": "string", "minLength": 1, "description": "Edition of the OWASP Top 10 for Agentic Applications that ASI01-ASI10 tags refer to, e.g. \"2026\"." },
        "owasp_mcp":     { "type": "string", "minLength": 1, "description": "Edition of the OWASP guide for Secure MCP Server Development that mcp tags refer to, e.g. \"2026\"." }
      }
    },

    "scan": {
      "type": "object", "additionalProperties": false,
      "required": ["agent", "agent_slug", "scan_date", "scan_timestamp", "workspace", "artifact_count"],
      "properties": {
        "agent":           { "type": "string", "minLength": 1 },
        "agent_slug":      { "type": "string", "minLength": 1, "pattern": "^[a-z0-9][a-z0-9-]*$" },
        "scan_date":       { "type": "string", "pattern": "^[0-9]{4}-[0-9]{2}-[0-9]{2}$" },
        "scan_timestamp":  { "type": "string", "pattern": "^[0-9]{4}-[0-9]{2}-[0-9]{2}T[0-9]{2}:[0-9]{2}:[0-9]{2}(\\.[0-9]+)?(Z|[+-][0-9]{2}:[0-9]{2})$", "description": "ISO 8601 timestamp with explicit timezone, e.g. 2026-05-03T04:39:06Z or 2026-05-03T00:39:06-04:00." },
        "workspace":       { "type": "string", "minLength": 1, "description": "Absolute path to the analyzed workspace." },
        "artifact_count":  { "type": "integer", "minimum": 0 },
        "remit_version":   { "type": "string", "minLength": 1, "description": "OPTIONAL provenance — the remit's own declared version (Identity table \"Remit Version\"). Added in Praxen 2.0; absent when the remit declares none, so pre-2.0 documents remain valid unchanged." }
      }
    },

    "intro_band": {
      "type": "object", "additionalProperties": false,
      "required": ["agent_remit_summary", "agent_structure_summary"],
      "properties": {
        "agent_remit_summary":     { "type": "string", "minLength": 1, "description": "2–4 sentences restating the agent's intended scope; may contain inline <code>/<strong>/<em>." },
        "agent_structure_summary": { "type": "string", "minLength": 1, "description": "2–4 sentences describing what was observed in the workspace; may contain inline <code>/<strong>/<em>." }
      }
    },

    "behavior_summary": { "type": "string", "minLength": 1, "description": "2–4 sentence dominant-pattern narrative; may contain <p>/<code>/<strong>/<em>." },

    "remit_coverage": {
      "type": "object", "additionalProperties": false,
      "required": ["stat_counts", "rules"],
      "properties": {
        "stat_counts": {
          "type": "object", "additionalProperties": false,
          "required": ["verified", "gap", "partial", "vague", "enp", "total"],
          "properties": {
            "verified": { "type": "integer", "minimum": 0 },
            "gap":      { "type": "integer", "minimum": 0 },
            "partial":  { "type": "integer", "minimum": 0 },
            "vague":    { "type": "integer", "minimum": 0 },
            "enp":      { "type": "integer", "minimum": 0 },
            "total":    { "type": "integer", "minimum": 0, "description": "Must equal len(rules); the runtime validator enforces this." }
          }
        },
        "rules": {
          "type": "array", "minItems": 1,
          "items": {
            "type": "object", "additionalProperties": false,
            "required": ["rule_id", "section", "rule_text", "status", "finding_id"],
            "properties": {
              "rule_id":    { "type": "string", "minLength": 1, "description": "R-NN style id; unique within rules[]." },
              "section":    { "type": "string", "minLength": 1 },
              "rule_text":  { "type": "string", "minLength": 1, "description": "Exact quoted text from the Worker Remit." },
              "status":     { "type": "string", "enum": ["verified", "gap", "partial", "vague", "enp"] },
              "finding_id": { "type": ["string", "null"], "description": "PRAX-... id of the linked finding, or null. The runtime validator asserts every non-null id exists in findings[]." }
            }
          }
        }
      }
    },

    "findings": {
      "type": "array",
      "description": "May be empty for a genuinely clean agent. Renderer sorts by severity (Critical first) preserving input order within a tier.",
      "items": {
        "type": "object", "additionalProperties": false,
        "required": [
          "id", "severity", "summary", "tags",
          "policy_rule_ids", "policy_rule_text", "evidence", "recommended_actions",
          "raise_category", "owasp_llm", "owasp_agentic",
          "confidence", "related_findings", "escalation"
        ],
        "properties": {
          "id":          { "type": "string", "pattern": "^PRAX-[0-9]{4}-[0-9]{2}-[0-9]{2}-[0-9]{3}$", "description": "PRAX-YYYY-MM-DD-NNN; unique." },
          "severity":    { "type": "string", "enum": ["Critical", "High", "Medium", "Low", "Informational"] },
          "summary":     { "type": "string", "minLength": 1, "description": "One-sentence card header; specific, not generic." },
          "description": { "type": "string", "description": "Optional longer-form body; carried in the JSON, surfaced in the report when the deferred L&F work lands (see design/DEFERRED.md). May contain inline <code>/<strong>/<em>." },
          "tags": {
            "type": "array", "minItems": 1,
            "items": {
              "type": "object", "additionalProperties": false,
              "required": ["kind", "label"],
              "properties": {
                "kind":  { "type": "string", "enum": ["raise", "owasp_llm", "owasp_agentic", "mcp"] },
                "label": { "type": "string", "minLength": 1, "description": "Full display name, e.g. 'LLM01 — Prompt Injection' (not just 'LLM01')." }
              }
            }
          },
          "policy_rule_ids":  { "type": ["array", "null"], "minItems": 1, "items": { "type": "string", "minLength": 1 }, "description": "Array of R-NN id(s) the finding violates, e.g. ['R-03'] or ['R-03','R-04']; or null if the finding does not trace to a specific Worker Remit rule (RAISE-category / detection-pattern findings often don't). Parallel to policy_rule_text (same length, element-aligned). Null exactly when policy_rule_text is null." },
          "policy_rule_text": { "type": ["array", "null"], "minItems": 1, "items": { "type": "string", "minLength": 1 }, "description": "Array of exact quoted remit texts the finding violates; element i is the text of policy_rule_ids[i]. Null exactly when policy_rule_ids is null." },
          "evidence": {
            "type": "array", "minItems": 1,
            "description": "Structured evidence items. The renderer formats each as 'file:line — snippet'.",
            "items": {
              "type": "object", "additionalProperties": false,
              "required": ["file", "line", "snippet"],
              "properties": {
                "file":    { "type": "string", "minLength": 1, "description": "Path relative to the workspace, or a workspace-relative identifier." },
                "line":    { "type": ["integer", "null"], "minimum": 1, "description": "Line number (1-indexed) or null for file-level evidence. Single integer only — for evidence that spans a range (e.g. a function body), put the start line here and carry the range syntax in `snippet` (e.g. 'request_approval node, lines 197-209 — …')." },
                "snippet": { "type": "string", "minLength": 1, "description": "Short observation or quoted context. Never reprint secrets — see SKILL.md." }
              }
            }
          },
          "recommended_actions": {
            "type": "array", "minItems": 1,
            "description": "One or more concrete actions. Renderer renders a single-item array as text, multi-item as a list.",
            "items": { "type": "string", "minLength": 1 }
          },
          "raise_category":  { "type": "string", "enum": ["limit_your_domain", "balance_your_knowledge_base", "implement_zero_trust", "manage_your_supply_chain", "build_an_ai_red_team", "monitor_continuously"] },
          "owasp_llm":       { "type": ["string", "null"], "pattern": "^LLM(0[1-9]|10)$", "description": "Canonical primary code LLM01–LLM10, or null. Single value: when a finding spans two LLM categories, the dominant attack pattern goes here and any secondary code goes in tags[] only — never comma-separated, never a list. The full 'CODE — Name' label goes in tags[]." },
          "owasp_agentic":   { "type": ["string", "null"], "pattern": "^ASI(0[1-9]|10)$", "description": "Canonical primary code ASI01–ASI10, or null. Single value: when a finding spans two ASI categories, the dominant attack pattern goes here and any secondary code goes in tags[] only — never comma-separated, never a list. The full 'CODE — Name' label goes in tags[]." },
          "confidence":      { "type": "string", "enum": ["High", "Medium", "Low"] },
          "related_findings":{ "type": "array", "items": { "type": "string", "pattern": "^PRAX-[0-9]{4}-[0-9]{2}-[0-9]{2}-[0-9]{3}$" }, "description": "PRAX-... ids of related findings; may be empty." },
          "escalation":      { "type": "string", "enum": ["alert", "log_only"], "description": "alert for Critical/High; log_only for Medium/Low/Informational." }
        }
      }
    },

    "positives": {
      "type": "array",
      "description": "Verified positive controls. May be empty.",
      "items": {
        "type": "object", "additionalProperties": false,
        "required": ["title", "description", "evidence_path"],
        "properties": {
          "title":         { "type": "string", "minLength": 1 },
          "description":   { "type": "string", "minLength": 1 },
          "evidence_path": { "type": "string", "minLength": 1, "description": "file:line, config key, or similar pointer." }
        }
      }
    },

    "log_files": {
      "type": "object", "additionalProperties": false,
      "required": ["present", "no_logs_note", "rows"],
      "properties": {
        "present":      { "type": "boolean" },
        "no_logs_note": { "type": "string", "description": "Required non-empty when present=false; may be empty otherwise." },
        "rows": {
          "type": "array",
          "description": "Empty exactly when present=false (the runtime validator enforces this).",
          "items": {
            "type": "object", "additionalProperties": false,
            "required": ["path", "source", "content_type", "purpose", "mtime", "status"],
            "properties": {
              "path":         { "type": "string", "minLength": 1 },
              "source":       { "type": "string", "minLength": 1 },
              "content_type": { "type": "string", "minLength": 1 },
              "purpose":      { "type": "string", "minLength": 1 },
              "mtime":        { "type": "string", "minLength": 1, "description": "Date or 'unknown'." },
              "status":       { "type": "string", "enum": ["active", "inferred"] }
            }
          }
        }
      }
    },

    "raise_posture": {
      "type": "object", "additionalProperties": false,
      "required": ["weighted_overall", "weighted_rationale", "categories"],
      "properties": {
        "weighted_overall":   { "type": "number", "minimum": 0.0, "maximum": 5.0, "description": "Σ(score × weight) over the scored (non-null) categories, divided by the sum of their weights — with no N/A category this is the classic fixed-weight sum. The runtime validator asserts the match within rounding." },
        "weighted_rationale": { "type": "string", "minLength": 1, "description": "2–4 sentence prose explaining the weighted overall in posture terms." },
        "categories": {
          "type": "array", "minItems": 6, "maxItems": 6,
          "description": "Exactly the six RAISE categories, in any order. Runtime validator enforces canonical render order, exact key/name pairs, and exact standard weights (Zero Trust 0.25; the other five 0.15).",
          "items": {
            "type": "object", "additionalProperties": false,
            "required": ["key", "name", "score", "confidence", "weight", "rationale"],
            "properties": {
              "key":        { "type": "string", "enum": ["limit_your_domain", "balance_your_knowledge_base", "implement_zero_trust", "manage_your_supply_chain", "build_an_ai_red_team", "monitor_continuously"] },
              "name":       { "type": "string", "minLength": 1, "description": "Display name, e.g. 'Limit Your Domain'. Must match the canonical name for the key." },
              "score":      { "type": ["integer", "null"], "minimum": 0, "maximum": 5, "description": "0-5, or null = N/A (every applicability trigger failed; category excluded, weights renormalized). Only the four vector-scored categories may be null - the validator enforces eligibility; Red Team and Monitor are presence-scored and never null." },
              "confidence": { "type": "string", "enum": ["High", "Medium", "Low"] },
              "weight":     { "type": "number", "enum": [0.15, 0.25], "description": "0.25 for Zero Trust; 0.15 for the other five. The validator enforces the per-key mapping." },
              "rationale":  { "type": "string", "minLength": 1, "description": "1–2 sentence prose grounded in specific evidence." }
            }
          }
        }
      }
    },

    "footer": {
      "type": "object", "additionalProperties": false,
      "required": ["severity_counts"],
      "properties": {
        "severity_counts": {
          "type": "object", "additionalProperties": false,
          "required": ["critical", "high", "medium", "low", "info"],
          "description": "Must match Counter(f.severity for f in findings) after mapping Informational→info; the runtime validator enforces this.",
          "properties": {
            "critical": { "type": "integer", "minimum": 0 },
            "high":     { "type": "integer", "minimum": 0 },
            "medium":   { "type": "integer", "minimum": 0 },
            "low":      { "type": "integer", "minimum": 0 },
            "info":     { "type": "integer", "minimum": 0 }
          }
        }
      }
    }
  }
}
